{
  "schema_version": "1.0.0",
  "assessment_id": "asmt-0002",
  "display_label": "Synthetic in-progress assessment (fixture, not a real customer)",
  "lifecycle_state": "DRAFT",
  "created_at": "2026-08-15T08:00:00Z",
  "as_executed_scope": {
    "target": "Synthetic internal-search assistant (fixture)",
    "environment": "Not yet finalized",
    "selected_attack_candidates": [
      { "asset_id": "ASA-ATK-005", "version": "0ea014b5e87deb8459ffaf51dc2dfa8823d51675", "source_kind": "attack_candidate" }
    ]
  },
  "engagement_context_reference": { "asset_id": "engagement-synthetic-0002", "version": "v1", "source_kind": "engagement_context" },
  "canonical_source_references": [
    { "asset_id": "docs/security/ATTACK_TAXONOMY.md", "version": "0ea014b5e87deb8459ffaf51dc2dfa8823d51675", "source_kind": "canonical_source" }
  ],
  "executions": [],
  "evidence": [],
  "findings": []
}
